"","X","Query","Google_Place","Lat","Lng","Loc.Type","Address","loc"
"1297",1297,"Peebles Elementary School, Bourne, Barnstable County, Massachusetts","Peebles Elementary School","41.7401336","-70.5910568","school","70 Trowbridge Rd, Buzzards Bay, MA 02532, United States","41.7401336:-70.5910568"
"1298",1298,"Peirce School, Arlington, Middlesex County, Massachusetts","Peirce","42.4285789","-71.178963","school","85 Park Avenue Extension, Arlington, MA 02474, United States","42.4285789:-71.178963"
"1299",1299,"Pelham Elementary School, Pelham, Hampshire County, Massachusetts","Pelham Elementary School","42.3781411","-72.4684998","school","45 Amherst Rd, Pelham, MA 01002, United States","42.3781411:-72.4684998"
"1300",1300,"Pembroke Community Middle School, Pembroke, Plymouth County, Massachusetts","Pembroke Community Middle School","42.0322164","-70.8012991","school","559 School St, Pembroke, MA 02359, United States","42.0322164:-70.8012991"
"1301",1301,"Pembroke High School, Pembroke, Plymouth County, Massachusetts","Pembroke High School","42.0536","-70.798","school","80 Learning Ln, Pembroke, MA 02359, United States","42.0536:-70.798"
"1302",1302,"Penn Brook School, Georgetown, Essex County, Massachusetts","Penn Brook School","42.7130823","-70.9850282","school","68 Elm St, Georgetown, MA 01833, United States","42.7130823:-70.9850282"
"1303",1303,"Pentucket Lake Elementary School, Haverhill, Essex County, Massachusetts","Pentucket Lake Elementary School","42.7951076","-71.0759643","school","252 Concord St, Haverhill, MA 01830, United States","42.7951076:-71.0759643"
"1304",1304,"Pentucket Regional Middle School, West Newbury, Essex County, Massachusetts","Pentucket Middle School","42.7804016","-71.0134745","school","20 Main St, West Newbury, MA 01985, United States","42.7804016:-71.0134745"
"1305",1305,"Pentucket Regional Sr High School, West Newbury, Essex County, Massachusetts","Pentucket Regional High School","42.7826407","-71.0123886","school","24 Main St, West Newbury, MA 01985, United States","42.7826407:-71.0123886"
"17701",1306,"Performing and Fine Arts High School, Lawrence, Essex County, Massachusetts","Performing & Fine Arts High School","42.6910308","-71.1452017","school","70 N Parish Rd, Lawrence, MA 01843, United States","42.6910308:-71.1452017"
"1307",1307,"Perley Elementary School, Georgetown, Essex County, Massachusetts","Perley Elementary School","42.726259","-70.9885797","school","51 North St, Georgetown, MA 01833, United States","42.726259:-70.9885797"
"1308",1308,"Peter Fitzpatrick School, Pepperell, Middlesex County, Massachusetts","Peter Fitzpatrick School","42.6653672","-71.5895129","school","Pepperell, MA 01463, United States","42.6653672:-71.5895129"
"1309",1309,"Peter Noyes School, Sudbury, Middlesex County, Massachusetts","Peter Noyes School","42.3825881","-71.409105","school","280 Old Sudbury Rd, Sudbury, MA 01776, United States","42.3825881:-71.409105"
"1310",1310,"Peter Thacher Elementary School, Attleboro, Bristol County, Massachusetts","Peter Thacher Elementary School","41.9317562","-71.280343","school","7 James St, Attleboro, MA 02703, United States","41.9317562:-71.280343"
"1311",1311,"Peter W Reilly School, Lowell, Middlesex County, Massachusetts","Peter W Reilly Elementary School","42.6409152","-71.2800231","school","115 Douglas Rd, Lowell, MA 01852, United States","42.6409152:-71.2800231"
"1312",1312,"Petersham School, Petersham, Worcester County, Massachusetts","Petersham Center","42.4856923","-72.1911092","school","31 Spring St, Petersham, MA 01366, United States","42.4856923:-72.1911092"
"1313",1313,"Philip G Coburn School, West Springfield, Hampden County, Massachusetts","Coburn Elementary School","42.1080777","-72.6211376","school","115 Southworth St, West Springfield, MA 01089, United States","42.1080777:-72.6211376"
"1314",1314,"Phillipston Memorial School, Phillipston, Worcester County, Massachusetts","Phillipston Memorial Elementary School","42.5617709","-72.1086668","school","20 The Common, Phillipston, MA 01331, United States","42.5617709:-72.1086668"
"1315",1315,"Phineas Bates School, Boston, Suffolk County, Massachusetts","Phineas Bates Elementary School","42.2777355","-71.1353939","school","426 Beech St, Roslindale, MA 02131, United States","42.2777355:-71.1353939"
"1316",1316,"Phoenix Academy Lawrence School, Lawrence, Essex County, Massachusetts","Phoenix Academy Lawrence","42.7075295","-71.1530376","school","15 Union St, Lawrence, MA 01840, United States","42.7075295:-71.1530376"
"1317",1317,"Phoenix Charter School, Chelsea, Suffolk County, Massachusetts","Phoenix Charter Academy","42.40684","-71.0382104","school","59 Nichols St, Chelsea, MA 02150, United States","42.40684:-71.0382104"
"1318",1318,"Pickering Middle School, Lynn, Essex County, Massachusetts","Pickering Middle School","42.4863684","-70.9581799","school","70 Conomo Ave, Lynn, MA 01904, United States","42.4863684:-70.9581799"
"1319",1319,"Pierce School, Brookline, Norfolk County, Massachusetts","Pierce Elementary School","42.3352154","-71.1207891","school","50 School St, Brookline, MA 02445, United States","42.3352154:-71.1207891"
"1320",1320,"Pine Glen Elementary School, Burlington, Middlesex County, Massachusetts","Pine Glen Elementary School","42.5217409","-71.2058802","school","1 Pine Glen Way, Burlington, MA 01803, United States","42.5217409:-71.2058802"
"1321",1321,"Pine Grove School, Rowley, Essex County, Massachusetts","Pine Grove Elementary School","42.7169949","-70.874446","school","191 Main St, Rowley, MA 01969, United States","42.7169949:-70.874446"
"1322",1322,"Pine Hill School, Sherborn, Middlesex County, Massachusetts","Pine Hill School","42.24809","-71.3648258","school","Sherborn, MA 01770, United States","42.24809:-71.3648258"
"1323",1323,"Pioneer Charter School of Science School, Everett, Middlesex County, Massachusetts","Pioneer Charter School of Science","42.4081101","-71.0510435","school","51 Summer St, Everett, MA 02149, United States","42.4081101:-71.0510435"
"1324",1324,"Pioneer Valley Chinese Immersion Charter School, Hadley, Hampshire County, Massachusetts","Pioneer Valley Chinese Immersion Charter School","42.3529752","-72.5581391","school","317 Russell St, Hadley, MA 01035, United States","42.3529752:-72.5581391"
"1325",1325,"Pioneer Valley Performing Arts Charter Public School, South Hadley, Hampshire County, Massachusetts","Pioneer Valley Performing Arts Charter Public School","42.2413417","-72.5993179","school","15 Mulligan Dr, South Hadley, MA 01075, United States","42.2413417:-72.5993179"
"1326",1326,"Pioneer Valley Regional School, Northfield, Franklin County, Massachusetts","Pioneer Valley Regional School","42.6834175","-72.4850881","school","97 F Sumner Turner Dr, Northfield, MA 01360, United States","42.6834175:-72.4850881"
"1327",1327,"Pittsfield High School, Pittsfield, Berkshire County, Massachusetts","Pittsfield High School","42.4464124","-73.2481544","school","300 East St, Pittsfield, MA 01201, United States","42.4464124:-73.2481544"
"1328",1328,"Placentino Elementary School, Holliston, Middlesex County, Massachusetts","Sam Placentino Elementary School","42.2070725","-71.422187","school","235 Woodland St, Holliston, MA 01746, United States","42.2070725:-71.422187"
"1329",1329,"Plains Elementary School, South Hadley, Hampshire County, Massachusetts","Plains School","42.2261307","-72.5733514","school","267 Granby Rd, South Hadley, MA 01075, United States","42.2261307:-72.5733514"
"1330",1330,"Pleasant Street School, Athol, Worcester County, Massachusetts","Pleasant Street School","42.573143","-72.2161938","school","1060 Pleasant St, Athol, MA 01331, United States","42.573143:-72.2161938"
"17711",1331,"214 MA-113, Methuen, MA, 01844","214 MA-113","42.7459901","-71.1317336","street_address","214 MA-113, Methuen, MA 01844, USA","42.7459901:-71.1317336"
"1332",1332,"Plum Cove School, Gloucester, Essex County, Massachusetts","Plum Cove School","42.6731503","-70.6592118","school","15 Hickory St, Gloucester, MA 01930, United States","42.6731503:-70.6592118"
"1333",1333,"Plunkett Elementary School, Adams, Berkshire County, Massachusetts","C T Plunkett Elementary School","42.6189718","-73.1203807","school","14 Commercial St, Adams, MA 01220, United States","42.6189718:-73.1203807"
"1334",1334,"Plymouth Commun Intermediate School, Plymouth, Plymouth County, Massachusetts","Plymouth Community Intermediate School","41.9227775","-70.6591756","school","117 Long Pond Rd, Plymouth, MA 02360, United States","41.9227775:-70.6591756"
"1335",1335,"Plymouth North High School, Plymouth, Plymouth County, Massachusetts","Plymouth North High School","41.9444075","-70.6521648","school","41 Obery St, Plymouth, MA 02360, United States","41.9444075:-70.6521648"
"1336",1336,"Plymouth River School, Hingham, Plymouth County, Massachusetts","Plymouth River Elementary School","42.2104095","-70.9021461","school","200 High St, Hingham, MA 02043, United States","42.2104095:-70.9021461"
"1337",1337,"Plymouth South High School, Plymouth, Plymouth County, Massachusetts","Plymouth South High School","41.8814931","-70.6166996","school","490 Long Pond Rd, Plymouth, MA 02360, United States","41.8814931:-70.6166996"
"1338",1338,"Plymouth South Middle School, Plymouth, Plymouth County, Massachusetts","Plymouth South Middle School","41.8864322","-70.6143665","school","488 Long Pond Road, Plymouth, MA 02360, United States","41.8864322:-70.6143665"
"1339",1339,"Point Webster Middle School, Quincy, Norfolk County, Massachusetts","Point Webster Middle School","42.2477519","-70.9910611","school","60 Lancaster St, Quincy, MA 02169, United States","42.2477519:-70.9910611"
"1340",1340,"Pollard Middle School, Needham, Norfolk County, Massachusetts","Pollard Middle School","42.2764304","-71.2266219","school","200 Harris Ave, Needham, MA 02492, United States","42.2764304:-71.2266219"
"1341",1341,"Potter Road School, Framingham, Middlesex County, Massachusetts","Potter Road Elementary School","42.337029","-71.4140947","school","492 Potter Rd, Framingham, MA 01701, United States","42.337029:-71.4140947"
"1342",1342,"Powder Mill School, Southwick, Hampden County, Massachusetts","Powder Mill Middle School","42.0625763","-72.7531243","school","94 Powder Mill Rd, Southwick, MA 01077, United States","42.0625763:-72.7531243"
"1343",1343,"Priest Street School, Leominster, Worcester County, Massachusetts","Priest Street","42.5376361","-71.7528825","school","115 Priest St, Leominster, MA 01453, United States","42.5376361:-71.7528825"
"1344",1344,"Primavera Junior/Senior High School, Bellingham, Norfolk County, Massachusetts","Primavera Junior-Senior High School","42.0784307","-71.4878392","school","Bellingham, MA 02019, United States","42.0784307:-71.4878392"
"1345",1345,"Proctor Elementary School, Topsfield, Essex County, Massachusetts","Proctor Elementary School","42.640618","-70.9515328","school","60 Main St, Topsfield, MA 01983, United States","42.640618:-70.9515328"
"1346",1346,"Prospect Hill Academy Charter School, Cambridge, Middlesex County, Massachusetts","Prospect Hill Academy","42.3674708","-71.1008204","school","50 Essex St, Cambridge, MA 02139, United States","42.3674708:-71.1008204"
"1347",1347,"Provincetown Schools School, Provincetown, Barnstable County, Massachusetts","Provincetown High School","42.0513919","-70.189651","school","12 Winslow St, Provincetown, MA 02657, United States","42.0513919:-70.189651"
"1348",1348,"Putnam Avenue Upper School, Cambridge, Middlesex County, Massachusetts","Putnam Avenue Upper School","42.3667886","-71.1129154","school","100 Putnam Ave, Cambridge, MA 02139, United States","42.3667886:-71.1129154"
"1349",1349,"Putnam Vocational Technical High School, Springfield, Hampden County, Massachusetts","Roger L Putnam Vocational Technical Academy","42.118491","-72.548695","school","1300 State St, Springfield, MA 01109, United States","42.118491:-72.548695"
"1350",1350,"Pyne Arts School, Lowell, Middlesex County, Massachusetts","Joseph G Pyne Elementary School","42.6289482","-71.2865589","school","145 Boylston St, Lowell, MA 01852, United States","42.6289482:-71.2865589"
"1351",1351,"Quabbin Regional High School, Barre, Worcester County, Massachusetts","Quabbin Regional High School","42.4005764","-72.1148897","school","800 South St, Barre, MA 01005, United States","42.4005764:-72.1148897"
"1352",1352,"Quabbin Regional Middle School, Barre, Worcester County, Massachusetts","Quabbin Regional High School","42.4005764","-72.1148897","school","800 South St, Barre, MA 01005, United States","42.4005764:-72.1148897"
"1353",1353,"Quaboag Regional High School, Warren, Worcester County, Massachusetts","Quaboag Regional High School","42.220419","-72.1881682","school","Warren, MA 01083, United States","42.220419:-72.1881682"
"1354",1354,"Quarry Hill Community School, Monson, Hampden County, Massachusetts","Quarry Hill Community School","42.1159276","-72.3295258","school","Monson, MA 01057, United States","42.1159276:-72.3295258"
"1355",1355,"Quashnet School, Mashpee, Barnstable County, Massachusetts","Quashnet Elementary School","41.623454","-70.4941342","school","150 Old Barnstable Rd, Mashpee, MA 02649, United States","41.623454:-70.4941342"
"1356",1356,"Quincy High School, Quincy, Norfolk County, Massachusetts","Quincy High School","42.2534823","-71.0001843","school","100 Coddington St, Quincy, MA 02169, United States","42.2534823:-71.0001843"
"1357",1357,"Quincy Upper School, Boston, Suffolk County, Massachusetts","Josiah Quincy Upper Schools","42.3484316","-71.0689199","school","152 Arlington St, Boston, MA 02116, United States","42.3484316:-71.0689199"
"1358",1358,"Quinsigamond School, Worcester, Worcester County, Massachusetts","Quinsigamond School","42.2338137","-71.7962326","school","14 Blackstone River Road, Blackstone, MA 01504, United States","42.2338137:-71.7962326"
"1359",1359,"R Stewart Esten School, Rockland, Plymouth County, Massachusetts","R Stewart Esten","42.1116925","-70.8964692","school","733 Summer St, Rockland, MA 02370, United States","42.1116925:-70.8964692"
"1360",1360,"R. K. Finn Ryan Road School, Northampton, Hampshire County, Massachusetts","RK Finn Ryan Road School","42.317189","-72.6935718","school","498 Ryan Rd, Florence, MA 01062, United States","42.317189:-72.6935718"
"1361",1361,"Rafael Hernandez School, Boston, Suffolk County, Massachusetts","Rafael Hernndez School","42.3139281","-71.0978417","school","61 School St, Roxbury, 02119, United States","42.3139281:-71.0978417"
"1362",1362,"Ralph B O'Maley Middle School, Gloucester, Essex County, Massachusetts","Ralph B O'Maley Middle School","42.6289357","-70.672918","school","32 Cherry St, Gloucester, MA 01930, United States","42.6289357:-70.672918"
"1363",1363,"Ralph C Mahar Regional School, Orange, Franklin County, Massachusetts","Ralph C Mahar Regional School","42.57585","-72.3024768","school","507 S Main St, Orange, MA 01364, United States","42.57585:-72.3024768"
"1364",1364,"Ralph D Butler School, Avon, Norfolk County, Massachusetts","Ralph D. Butler Elementary","42.1160049","-71.0457402","school","1 Patrick Clark Dr, Avon, MA 02322, United States","42.1160049:-71.0457402"
"1365",1365,"Ralph Talbot School, Weymouth, Norfolk County, Massachusetts","Ralph Talbot","42.1763003","-70.9353245","school","277 Ralph Talbot St, South Weymouth, MA 02190, United States","42.1763003:-70.9353245"
"1366",1366,"Ralph Wheelock School, Medfield, Norfolk County, Massachusetts","Ralph Wheelock School","42.1746745","-71.2901715","school","Medfield, MA 02052, United States","42.1746745:-71.2901715"
"1367",1367,"Randolph Community Middle School, Randolph, Norfolk County, Massachusetts","Randolph Community Middle School","42.1837062","-71.0648203","school","225 High St, Randolph, MA 02368, United States","42.1837062:-71.0648203"
"1368",1368,"Randolph High School, Randolph, Norfolk County, Massachusetts","Randolph High School","42.1629555","-71.0442226","school","70 Memorial Pkwy, Randolph, MA 02368, United States","42.1629555:-71.0442226"
"1369",1369,"Raymond E. Shaw Elementary School, Millbury, Worcester County, Massachusetts","Raymond E. Shaw Elementary School","42.1855925","-71.7734087","school","58 Elmwood St, Millbury, MA 01527, United States","42.1855925:-71.7734087"
"1370",1370,"Raymond J Grey Junior High School, Acton, Middlesex County, Massachusetts","R.J. Grey Junior High School","42.476282","-71.4581929","school","16 Charter Rd, Acton, MA 01720, United States","42.476282:-71.4581929"
"1371",1371,"Raynham Middle School, Raynham, Bristol County, Massachusetts","Raynham Middle School","41.94575","-71.035752","school","420 Titicut Rd, Raynham, MA 02767, United States","41.94575:-71.035752"
"1372",1372,"Reading Memorial High School, Reading, Middlesex County, Massachusetts","Reading Memorial High School","42.5346489","-71.1091032","school","62 Oakland Rd, Reading, MA 01867, United States","42.5346489:-71.1091032"
"1373",1373,"Reay E Sterling Middle School, Quincy, Norfolk County, Massachusetts","Sterling Middle School","42.240146","-71.0158952","school","444 Granite St, Quincy, MA 02169, United States","42.240146:-71.0158952"
"1374",1374,"Rebecca M Johnson School, Springfield, Hampden County, Massachusetts","Rebecca M Johnson School","42.1130595","-72.5646222","school","55 Catharine St, Springfield, MA 01109, United States","42.1130595:-72.5646222"
"1375",1375,"Reingold Elementary School, Fitchburg, Worcester County, Massachusetts","Reingold Elementary School","42.571385","-71.830917","school","70 Reingold Ave, Fitchburg, MA 01420, United States","42.571385:-71.830917"
"1376",1376,"Remington Middle School, Franklin, Norfolk County, Massachusetts","Remington Middle School","42.0524874","-71.4181586","school","628 Washington St, Franklin, MA 02038, United States","42.0524874:-71.4181586"
"1377",1377,"Resiliency Preparatory School, Fall River, Bristol County, Massachusetts","Resiliency Preparatory School","41.7086626","-71.1530368","school","276 Maple St, Fall River, MA 02720, United States","41.7086626:-71.1530368"
"1378",1378,"Revere High School, Revere, Suffolk County, Massachusetts","Revere High School","42.4120796","-71.008181","school","101 School St, Revere, MA 02151, United States","42.4120796:-71.008181"
"1379",1379,"Rice Square School, Worcester, Worcester County, Massachusetts","Rice Square Elementary School","42.2480279","-71.7771123","school","76 Massasoit Rd, Worcester, MA 01604, United States","42.2480279:-71.7771123"
"1380",1380,"Richard J Murphy School, Boston, Suffolk County, Massachusetts","Richard J. Murphy School","42.2940401","-71.0490059","school","1 Worrell St, Dorchester, MA 02122, United States","42.2940401:-71.0490059"
"1381",1381,"Richer School, Marlborough, Middlesex County, Massachusetts","Richer Elementary School","42.3383203","-71.5784436","school","80 Foley Rd, Marlborough, MA 01752, United States","42.3383203:-71.5784436"
"1382",1382,"Richmond Consolidated School, Richmond, Berkshire County, Massachusetts","Richmond Consolidated","42.3815892","-73.3673212","school","1831 State Rd, Richmond, MA 01254, United States","42.3815892:-73.3673212"
"1383",1383,"Rindge Avenue Upper School, Cambridge, Middlesex County, Massachusetts","Rindge Avenue Upper School","42.3922447","-71.1282134","school","70 Rindge Ave, Cambridge, MA 02140, United States","42.3922447:-71.1282134"
"1384",1384,"RISE PreSchool, Reading, Middlesex County, Massachusetts","Rise Pre-School","42.5346394","-71.1091425","school","62 Oakland Rd, Reading, MA 01867, United States","42.5346394:-71.1091425"
"1385",1385,"Rising Tide Charter Public School, Plymouth, Plymouth County, Massachusetts","Rising Tide Charter Public School","41.9514856","-70.708039","school","6 Resnik Rd, Plymouth, MA 02360, United States","41.9514856:-70.708039"
"1386",1386,"Rita E. Miller Elementary School, Westford, Middlesex County, Massachusetts","Rita E. Miller Elementary School","42.6416152","-71.4316151","school","1 Mitchell Way, Westford, MA 01886, United States","42.6416152:-71.4316151"
"1387",1387,"River Valley Charter School, Newburyport, Essex County, Massachusetts","River Valley Charter School","42.807227","-70.8866218","school","2 Perry Way, Newburyport, MA 01950, United States","42.807227:-70.8866218"
"1388",1388,"Riverbend School, Athol, Worcester County, Massachusetts","Riverbend School","42.592587","-72.2228607","school","174 Riverbend St, Athol, MA 01331, United States","42.592587:-72.2228607"
"1389",1389,"Riverdale School, Dedham, Norfolk County, Massachusetts","Riverdale School","42.2700558","-71.180308","school","100 Whiting Ave, Dedham, MA 02026, United States","42.2700558:-71.180308"
"1390",1390,"Riverside School, Danvers, Essex County, Massachusetts","Riverside","42.5603302","-70.9234286","school","95 Liberty St, Danvers, MA 01923, United States","42.5603302:-70.9234286"
"1391",1391,"Robert E. Melican Middle School, Northborough, Worcester County, Massachusetts","ROBERT E. MELICAN MIDDLE SCHOOL","42.3202961","-71.6592852","school","145 Lincoln St, Northborough, MA 01532, United States","42.3202961:-71.6592852"
"1392",1392,"Robert Frost School, Lawrence, Essex County, Massachusetts","Robert Frost Elementary School","42.6848977","-71.1678028","school","33 Hamlet St, Lawrence, MA 01843, United States","42.6848977:-71.1678028"
"1393",1393,"Robert H. Adams Middle School, Holliston, Middlesex County, Massachusetts","Robert Adams Middle School","42.204449","-71.4233443","school","323 Woodland St, Holliston, MA 01746, United States","42.204449:-71.4233443"
"1394",1394,"Robert J. Coelho Middle School, Attleboro, Bristol County, Massachusetts","Robert J Coelho Middle School","41.9096054","-71.3688613","school","99 Brown St, Attleboro, MA 02703, United States","41.9096054:-71.3688613"
"1395",1395,"Robert L Ford School, Lynn, Essex County, Massachusetts","Robert L Ford School","42.4713101","-70.9469985","school","49 Hollingworth Street, Lynn, MA 1902, United States","42.4713101:-70.9469985"
"1396",1396,"Robert T. Capeless Elementary School, Pittsfield, Berkshire County, Massachusetts","Robert T. Capeless Elementary School","42.4804878","-73.260573","school","86 Brooks Ave, Pittsfield, MA 01201, United States","42.4804878:-73.260573"
"1397",1397,"Roberta G. Doering School, Agawam, Hampden County, Massachusetts","Doering School","42.0878628","-72.6249679","school","68 Main St, Agawam, MA 01001, United States","42.0878628:-72.6249679"
"1398",1398,"Robin Hood School, Stoneham, Middlesex County, Massachusetts","Robin Hood School","42.4934405","-71.107586","school","70 Oak St, Stoneham, MA 02180, United States","42.4934405:-71.107586"
"1399",1399,"Robinson Park School, Agawam, Hampden County, Massachusetts","Robinson Park Elementary School","42.0898205","-72.6418162","school","Agawam, MA 01001, United States","42.0898205:-72.6418162"
"1400",1400,"Rochester Memorial School, Rochester, Plymouth County, Massachusetts","Rochester Memorial Elementary School","41.7460073","-70.8668978","school","16 Pine St, Rochester, MA 02770, United States","41.7460073:-70.8668978"
"1401",1401,"Rockland Senior High School, Rockland, Plymouth County, Massachusetts","Rockland Senior High School","42.1285895","-70.917381","school","52 Mackinlay Way, Rockland, MA 02370, United States","42.1285895:-70.917381"
"1402",1402,"Rockport Elementary School, Rockport, Essex County, Massachusetts","Rockport Elementary School","42.6509425","-70.6110728","school","24 Jerdens Ln, Rockport, MA 01966, United States","42.6509425:-70.6110728"
"1403",1403,"Rockport High School, Rockport, Essex County, Massachusetts","Rockport High School","42.6520828","-70.6095813","school","24 Jerdens Ln, Rockport, MA 01966, United States","42.6520828:-70.6095813"
"1404",1404,"Rockport Middle School, Rockport, Essex County, Massachusetts","Rockport Middle School","42.6518725","-70.6101587","school","26 Jerdens Ln, Rockport, MA 01966, United States","42.6518725:-70.6101587"
"1405",1405,"Rodman Early Childhood School, Canton, Norfolk County, Massachusetts","Rodman Early Childhood Center","42.1634071","-71.1443241","school","960 Washington St, Canton, MA 02021, United States","42.1634071:-71.1443241"
"1406",1406,"Roger Clap School, Boston, Suffolk County, Massachusetts","Roger Clap Innovation School","42.3232057","-71.0581739","school","35 Harvest St, Dorchester, MA 02125, United States","42.3232057:-71.0581739"
"1407",1407,"Roger E Wellington School, Belmont, Middlesex County, Massachusetts","Roger E Wellington School","42.3922262","-71.1719884","school","121 Orchard St, Belmont, MA 02478, United States","42.3922262:-71.1719884"
"1408",1408,"Rogers School, Fairhaven, Bristol County, Massachusetts","Rogers School","41.6357306","-70.8989737","school","100 Pleasant St, Fairhaven, MA 02719, United States","41.6357306:-70.8989737"
"1409",1409,"Rogers Early Learning School, Lowell, Middlesex County, Massachusetts","Creative Minds Early Learning Centers","42.663242","-71.268515","school","920 Methuen St, Dracut, MA 01826, United States","42.663242:-71.268515"
"1410",1410,"Roland Green School, Mansfield, Bristol County, Massachusetts","Roland Green Pre-School","42.0252996","-71.2221264","school","29 Dean St, Mansfield, MA 02048, United States","42.0252996:-71.2221264"
"1411",1411,"Rollins Early Childhood School, Lawrence, Essex County, Massachusetts","The Rollins Early Childhood Center","42.7140441","-71.1485391","school","451 Howard St, Lawrence, MA 01841, United States","42.7140441:-71.1485391"
"1412",1412,"Roosevelt School, Worcester, Worcester County, Massachusetts","Roosevelt Elementary School","42.243133","-71.7570582","school","1006 Grafton St, Worcester, MA 01604, United States","42.243133:-71.7570582"
"1413",1413,"Roosevelt Avenue School, North Attleborough, Bristol County, Massachusetts","Roosevelt Avenue Elem School","41.9784","-71.341058","school","108 Roosevelt Ave, North Attleborough, MA 02760, United States","41.9784:-71.341058"
