"","X","Query","Google_Place","Lat","Lng","Loc.Type","Address","loc"
"474",474,"Edith C Baker School, Brookline, Norfolk County, Massachusetts","Baker School","42.3027008","-71.1582051","school","205 Beverly Rd, Chestnut Hill, MA 02467, United States","42.3027008:-71.1582051"
"475",475,"Edmund Hatch Bennett School, Taunton, Bristol County, Massachusetts","Edmund Hatch Bennett School","41.9030063","-71.1382287","school","47 N Walker St, Taunton, MA 02780, United States","41.9030063:-71.1382287"
"476",476,"Edward A Sisson School, Lynn, Essex County, Massachusetts","Edward A Sisson School","42.4865","-70.9564","school","Lynn, MA 01904, United States","42.4865:-70.9564"
"477",477,"Edward Devotion School, Brookline, Norfolk County, Massachusetts","The Edward Devotion School","42.3447253","-71.1239401","school","345 Harvard St, Brookline, MA 02446, United States","42.3447253:-71.1239401"
"478",478,"Edward Everett School, Boston, Suffolk County, Massachusetts","Edward Everett Elementary School","42.3136479","-71.0597921","school","71 Pleasant St, Dorchester, MA 02125, United States","42.3136479:-71.0597921"
"479",479,"Edward F Leddy School, Taunton, Bristol County, Massachusetts","Edward F Leddy Elementary School","41.8865738","-71.0939695","school","36 2nd St, Taunton, MA 02780, United States","41.8865738:-71.0939695"
"480",480,"Edward F. Parthum School, Lawrence, Essex County, Massachusetts","Parthum Elementary School","42.7185414","-71.1432666","school","255 E Haverhill St, Lawrence, MA 01841, United States","42.7185414:-71.1432666"
"481",481,"Edward G. Molin Elementary School, Newburyport, Essex County, Massachusetts","Molin Upper Elementary School","42.8088651","-70.8874225","school","70 Low St, Newburyport, MA 01950, United States","42.8088651:-70.8874225"
"482",482,"Edward M. Kennedy Academy for Health Careers (Horace Mann Charter School) School, Boston, Suffolk County, Massachusetts","Edward M. Kennedy Academy Health Careers","42.3415006","-71.0914804","school","110 Fenway, Boston, MA 02115, United States","42.3415006:-71.0914804"
"483",483,"Edwin A Jones Early Childhood School, Stoughton, Norfolk County, Massachusetts","Edwin A Jones","42.1230786","-71.0969057","school","137 Walnut St, Stoughton, MA 02072, United States","42.1230786:-71.0969057"
"484",484,"Egremont School, Pittsfield, Berkshire County, Massachusetts","Egremont Elementary School","42.437286","-73.229957","school","84 Egremont Ave, Pittsfield, MA 01201, United States","42.437286:-73.229957"
"485",485,"Elbridge Gerry School, Marblehead, Essex County, Massachusetts","Elbridge Gerry School","42.5064797","-70.8501688","school","50 Elm St, Marblehead, MA 01945, United States","42.5064797:-70.8501688"
"486",486,"Eleanor N Johnson Middle School, Walpole, Norfolk County, Massachusetts","Eleanor N Johnson Middle School","42.1509066","-71.2566704","school","111 Robbins Rd, Walpole, MA 02081, United States","42.1509066:-71.2566704"
"487",487,"Elias Brookings School, Springfield, Hampden County, Massachusetts","Elias Brookings Magnet School","42.0986549","-72.5651681","school","Springfield, MA 01105, United States","42.0986549:-72.5651681"
"488",488,"Elihu Greenwood Leadership School, Boston, Suffolk County, Massachusetts","Elihu Greenwood School","42.2653839","-71.1174871","school","612 Metropolitan Ave, Hyde Park, MA 02136, United States","42.2653839:-71.1174871"
"489",489,"Eliot Elementary School, Boston, Suffolk County, Massachusetts","Eliot School","42.3662107","-71.0535086","school","16 Charter St, Boston, MA 02113, United States","42.3662107:-71.0535086"
"490",490,"Elizabeth Carter Brooks School, New Bedford, Bristol County, Massachusetts","Elizabeth Carter Brooks","41.6431879","-70.9533825","school","212 Nemasket St, New Bedford, MA 02740, United States","41.6431879:-70.9533825"
"491",491,"Elizabeth G Lyons Elementary School, Randolph, Norfolk County, Massachusetts","Elizabeth G Lyons Elementary School","42.1774183","-71.040524","school","60 Vesey Rd, Randolph, MA 02368, United States","42.1774183:-71.040524"
"492",492,"Elizabeth Pole School, Taunton, Bristol County, Massachusetts","Elizabeth Pole","41.902065","-71.0655964","school","215 Harris St, Taunton, MA 02780, United States","41.902065:-71.0655964"
"493",493,"Elizabeth S Brown School, Swansea, Bristol County, Massachusetts","Elizabeth S Brown Elementary","41.7481455","-71.1975914","school","29 Gardners Neck Road, Swansea, MA 02777, United States","41.7481455:-71.1975914"
"494",494,"Ellen R Hathaway School, New Bedford, Bristol County, Massachusetts","Ellen R Hathaway","41.6331596","-70.9400385","school","New Bedford, MA 02740, United States","41.6331596:-70.9400385"
"495",495,"Ellis Mendell School, Boston, Suffolk County, Massachusetts","Mendell Elementary School","42.3165452","-71.1015576","school","164 School St, Boston, MA 02130, United States","42.3165452:-71.1015576"
"496",496,"Elm Park Community School, Worcester, Worcester County, Massachusetts","Elm Park Elementary School","42.2690657","-71.8073065","school","Worcester, MA 01609, United States","42.2690657:-71.8073065"
"497",497,"Elm Street School, Walpole, Norfolk County, Massachusetts","Elm Street School","42.1540075","-71.2674419","school","415 Elm St, Walpole, MA 02081, United States","42.1540075:-71.2674419"
"498",498,"Elmer S Bagnall School, Groveland, Essex County, Massachusetts","Elmer S Bagnall","42.7433505","-71.0237806","school","253 School St, Groveland, MA 01834, United States","42.7433505:-71.0237806"
"499",499,"Elmwood School, Hopkinton, Middlesex County, Massachusetts","Elmwood School","42.2253701","-71.5395643","school","14 Elm St, Hopkinton, MA 01748, United States","42.2253701:-71.5395643"
"500",500,"Elmwood Street School, Millbury, Worcester County, Massachusetts","Elmwood Street Elementary School","42.1875269","-71.7731881","school","40 Elmwood St, Millbury, MA 01527, United States","42.1875269:-71.7731881"
"501",501,"Elsie A Hastings Elementary School, Westborough, Worcester County, Massachusetts","Hastings Elementary School","42.2793606","-71.6024378","school","111 E Main St, Westborough, MA 01581, United States","42.2793606:-71.6024378"
"502",502,"Elwyn G Campbell School, New Bedford, Bristol County, Massachusetts","Elwyn G Campbell","41.7020477","-70.9375393","school","New Bedford, MA 02745, United States","41.7020477:-70.9375393"
"503",503,"Emily G Wetherbee School, Lawrence, Essex County, Massachusetts","Wetherbee School","42.6943964","-71.1666551","school","75 Newton St, Lawrence, MA 01843, United States","42.6943964:-71.1666551"
"504",504,"Emma L Miller Elementary School, Savoy, Berkshire County, Massachusetts",NA,NA,NA,NA,NA,"NA:NA"
"505",505,"Ephraim Curtis Middle School, Sudbury, Middlesex County, Massachusetts","Ephraim Curtis Middle School","42.3805482","-71.4334273","school","22 Pratts Mill Rd, Sudbury, MA 01776, United States","42.3805482:-71.4334273"
"506",506,"Ernest F Upham School, Wellesley, Norfolk County, Massachusetts","Upham Elementary School","42.3110343","-71.2992645","school","35 Wynnewood Rd, Wellesley Hills, MA 02481, United States","42.3110343:-71.2992645"
"507",507,"Erving Elementary School, Erving, Franklin County, Massachusetts","Erving Elementary School","42.5895306","-72.4848097","school","28 Northfield Rd, Erving, MA 01344, United States","42.5895306:-72.4848097"
"508",508,"Essex Agricultural and Technical Institute School, Danvers, Essex County, Massachusetts","Essex Technical High School","42.5915093","-70.9781158","school","565 Maple St, Hathorne, MA 01923, United States","42.5915093:-70.9781158"
"509",509,"Essex Elementary School, Essex, Essex County, Massachusetts","Essex Elementary School","42.6320387","-70.7903257","school","12 Story St, Essex, MA 01929, United States","42.6320387:-70.7903257"
"510",510,"Eugene C Vining School, Billerica, Middlesex County, Massachusetts","Eugene C. Vining Elementary School","42.533805","-71.258837","school","121 Lexington Rd, Billerica, MA 01821, United States","42.533805:-71.258837"
"511",511,"Eugene Wright Science and Technology School, Chelsea, Suffolk County, Massachusetts","Eugene Wright Science And Technology Academy","42.3939302","-71.0367635","school","180 Walnut St, Chelsea, MA 02150, United States","42.3939302:-71.0367635"
"512",512,"Everett High School, Everett, Middlesex County, Massachusetts","Everett High School","42.414317","-71.043708","school","100 Elm St, Everett, MA 02149, United States","42.414317:-71.043708"
"513",513,"Everett W Robinson School, Mansfield, Bristol County, Massachusetts","Everett W Robinson","42.0276691","-71.2048367","school","245 East St, Mansfield, MA 02048, United States","42.0276691:-71.2048367"
"514",514,"Excel Academy Charter School, Boston, Suffolk County, Massachusetts","Excel Academy - Orient Heights","42.3844511","-70.9989849","school","1150 Saratoga St, Boston, MA 02128, United States","42.3844511:-70.9989849"
"515",515,"Excel High School, Boston, Suffolk County, Massachusetts","Excel High School","42.3329047","-71.0448291","school","95 G St, Boston, MA 02127, United States","42.3329047:-71.0448291"
"516",516,"Ezra H Baker School, Dennis, Barnstable County, Massachusetts","Ezra H Baker","41.6685119","-70.152619","school","810 MA-28, West Dennis, MA 02670, United States","41.6685119:-70.152619"
"517",517,"F A Cleveland School, Norwood, Norfolk County, Massachusetts","F A Cleveland School","42.1840611","-71.2198952","school","Norwood, MA 02062, United States","42.1840611:-71.2198952"
"518",518,"F A Day Middle School, Newton, Middlesex County, Massachusetts","F.A. Day Middle School","42.3580861","-71.2131455","school","21 Minot Pl, Newtonville, MA 02460, United States","42.3580861:-71.2131455"
"519",519,"F L Olmsted School, Easton, Bristol County, Massachusetts","F.L. Olmsted School","42.0575867","-71.1112045","school","101 Lothrop St, North Easton, MA 02356, United States","42.0575867:-71.1112045"
"520",520,"Fairhaven High School, Fairhaven, Bristol County, Massachusetts","Fairhaven High School","41.6435508","-70.9053445","school","12 Huttleston Ave, Fairhaven, MA 02719, United States","41.6435508:-70.9053445"
"521",521,"Fairview Middle School, Chicopee, Hampden County, Massachusetts","Fairview Elementary School","42.2073144","-72.5745331","school","26 Memorial Ave, Chicopee, MA 01020, United States","42.2073144:-72.5745331"
"522",522,"Fall Brook School, Leominster, Worcester County, Massachusetts","Fallbrook Elementary School","42.495517","-71.7680784","school","25 Decicco Dr, Leominster, MA 01453, United States","42.495517:-71.7680784"
"523",523,"Falls School, North Attleborough, Bristol County, Massachusetts","Falls Elementary School","41.9722919","-71.3144812","school","2 Jackson St, Attleboro Falls, MA 02763, United States","41.9722919:-71.3144812"
"524",524,"Falmouth High School, Falmouth, Barnstable County, Massachusetts","Falmouth High School","41.5900693","-70.6075637","school","874 Gifford St, East Falmouth, MA 02536, United States","41.5900693:-70.6075637"
"525",525,"Fannie E Proctor School, Northborough, Worcester County, Massachusetts","Fannie E Proctor School","42.3025937","-71.6531233","school","Northborough, MA 01532, United States","42.3025937:-71.6531233"
"526",526,"Farmington River Elementary School, Otis, Berkshire County, Massachusetts","Farmington River Regional School District","42.2071351","-73.0960563","school","555 N Main Rd, Otis, MA 01253, United States","42.2071351:-73.0960563"
"527",527,"Fecteau-Leary Junior/Senior High School, Lynn, Essex County, Massachusetts","Fecteau - Leary Junior Senior Alternative High School","42.4647498","-70.9550191","school","33 N Common St, Lynn, MA 01902, United States","42.4647498:-70.9550191"
"528",528,"Federal School, Greenfield, Franklin County, Massachusetts","Federal Street School","42.5913933","-72.5977013","school","125 Federal St, Greenfield, MA 01301, United States","42.5913933:-72.5977013"
"529",529,"Federal Furnace School, Plymouth, Plymouth County, Massachusetts","Federal Furnace Elementary School","41.8928713","-70.7130017","school","Federal Furnace Elementary School, 860 Federal Furnace Rd, Plymouth, MA 02360, USA","41.8928713:-70.7130017"
"530",530,"Fenway High School, Boston, Suffolk County, Massachusetts","Fenway High School","42.3306688","-71.0993011","school","67 Alleghany St, Boston, MA 02120, United States","42.3306688:-71.0993011"
"531",531,"Ferryway School, Malden, Middlesex County, Massachusetts","Ferryway School","42.4214157","-71.0595501","school","150 Cross St, Malden, MA 02148, United States","42.4214157:-71.0595501"
"532",532,"Field Elementary School, Weston, Middlesex County, Massachusetts","FIELD ELEMENTARY SCHOOL","42.3615082","-71.2958809","school","16 Alphabet Ln, Weston, MA 02493, United States","42.3615082:-71.2958809"
"533",533,"Fisher School, Walpole, Norfolk County, Massachusetts","Fisher Elementary School","42.1617654","-71.24249","school","Walpole, MA 02081, United States","42.1617654:-71.24249"
"534",534,"Fisher Hill School, Orange, Franklin County, Massachusetts","Fisher Hill Elementary School","42.5972369","-72.3110756","school","59 Dexter St, Orange, MA 01364, United States","42.5972369:-72.3110756"
"535",535,"Fiske School, Lexington, Middlesex County, Massachusetts","Fiske Elementary School","42.4584944","-71.2202099","school","55 Adams St, Lexington, MA 02421, United States","42.4584944:-71.2202099"
"536",536,"Fitchburg High School, Fitchburg, Worcester County, Massachusetts","Fitchburg High School","42.6214034","-71.8077778","school","140 Arn-How Farm Rd, Fitchburg, MA 01420, United States","42.6214034:-71.8077778"
"537",537,"Flagg Street School, Worcester, Worcester County, Massachusetts","Flagg Street School","42.2838244","-71.831879","school","115 Flagg St, Worcester, MA 01602, United States","42.2838244:-71.831879"
"538",538,"Fletcher/Maynard School, Cambridge, Middlesex County, Massachusetts","Fletcher-Maynard Elementary","42.3668215","-71.0957828","school","225 Windsor St, Cambridge, MA 02139, United States","42.3668215:-71.0957828"
"539",539,"Floral Street School, Shrewsbury, Worcester County, Massachusetts","Floral Street School","42.2839067","-71.6939806","school","57 Floral St, Shrewsbury, MA 01545, United States","42.2839067:-71.6939806"
"540",540,"Florence Roche School, Groton, Middlesex County, Massachusetts","Florence Roche School","42.6159235","-71.578401","school","342 Main St, Groton, MA 01450, United States","42.6159235:-71.578401"
"541",541,"Florence Sawyer School, Bolton, Worcester County, Massachusetts","Florence Sawyer School","42.4300454","-71.6088653","school","100 Mechanic St, Bolton, MA 01740, United States","42.4300454:-71.6088653"
"542",542,"Forest Avenue Elementary School, Hudson, Middlesex County, Massachusetts","Forest Avenue Elementary School","42.3900934","-71.5453429","school","Hudson, MA 01749, United States","42.3900934:-71.5453429"
"543",543,"Forest Grove Middle School, Worcester, Worcester County, Massachusetts","Forest Grove Middle School","42.2887957","-71.8128446","school","495 Grove St, Worcester, MA 01605, United States","42.2887957:-71.8128446"
"544",544,"Forest Park Middle School, Springfield, Hampden County, Massachusetts","Forest Park Middle School","42.0859829","-72.5642417","school","46 Oakland St, Springfield, MA 01108, United States","42.0859829:-72.5642417"
"545",545,"Forestdale School, Sandwich, Barnstable County, Massachusetts","Forestdale School","41.696853","-70.5048037","school","151 MA-130, Forestdale, MA 02644, United States","41.696853:-70.5048037"
"546",546,"Fort Meadow Early Childhood School, Westfield, Hampden County, Massachusetts","Fort Meadow Early Childhood Center","42.121471","-72.743251","school","35 White St, Westfield, MA 01085, United States","42.121471:-72.743251"
"547",547,"Fort River Elementary School, Amherst, Hampshire County, Massachusetts","Fort River Elementary School","42.374791","-72.497669","school","70 S East St, Amherst, MA 01002, United States","42.374791:-72.497669"
"548",548,"Four Corners School, Greenfield, Franklin County, Massachusetts","The Discovery School at Four Corners","42.609313","-72.588744","school","21 Ferrante Ave, Greenfield, MA 01301, United States","42.609313:-72.588744"
"549",549,"Four Rivers Charter Public School, Greenfield, Franklin County, Massachusetts","Four Rivers Charter Public School","42.596248","-72.620715","school","248 Colrain Rd, Greenfield, MA 01301, United States","42.596248:-72.620715"
"550",550,"Fowler School, Maynard, Middlesex County, Massachusetts","Fowler School","42.4215034","-71.4567615","school","3 Tiger Dr, Maynard, MA 01754, United States","42.4215034:-71.4567615"
"551",551,"Fox Hill School, Burlington, Middlesex County, Massachusetts","Fox Hill School","42.5293023","-71.1890244","school","Fox Hill Rd, Burlington, MA 01803, United States","42.5293023:-71.1890244"
"552",552,"Foxborough High School, Foxborough, Norfolk County, Massachusetts","Foxborough High School","42.0545821","-71.250376","school","120 South St, Foxborough, MA 02035, United States","42.0545821:-71.250376"
"553",553,"Foxborough Regional Charter School, Foxborough, Norfolk County, Massachusetts","Foxboro Regional Charter School","42.05689","-71.244916","school","131 Central St, Foxborough, MA 02035, United States","42.05689:-71.244916"
"554",554,"Framingham High School, Framingham, Middlesex County, Massachusetts","Framingham High School","42.318635","-71.403192","school","115 A St, Framingham, MA 01701, United States","42.318635:-71.403192"
"555",555,"Francis J Burke Elementary School, Medway, Norfolk County, Massachusetts","Francis J Burke Elementary School","42.1422778","-71.4076566","school","Medway, MA 02053, USA","42.1422778:-71.4076566"
"556",556,"Francis J Kane School, Marlborough, Middlesex County, Massachusetts","Francis J Kane Elementary School","42.3430107","-71.5202162","school","520 Farm Rd, Marlborough, MA 01752, United States","42.3430107:-71.5202162"
"557",557,"Francis J McGrath Elementary School, Worcester, Worcester County, Massachusetts","Francis J McGrath Elementary School","42.2851289","-71.812848","school","493 Grove St, Worcester, MA 01605, United States","42.2851289:-71.812848"
"558",558,"Francis M Leahy School, Lawrence, Essex County, Massachusetts","Leahy School","42.7146346","-71.1614877","school","100 Erving Ave, Lawrence, MA 01841, United States","42.7146346:-71.1614877"
"559",559,"Francis T Bresnahan Elementary School, Newburyport, Essex County, Massachusetts","Francis T Bresnahan Elementary School","42.8200233","-70.8959085","school","333 High St, Newburyport, MA 01950, United States","42.8200233:-70.8959085"
"560",560,"Francis W Parker School, Quincy, Norfolk County, Massachusetts","Francis W Parker Elementary School","42.2760937","-71.0215883","school","Francis W Parker Elementary School, 148 Billings Rd, Quincy, MA 02171, USA","42.2760937:-71.0215883"
"561",561,"Francis W. Parker Charter Essential School, Harvard, Worcester County, Massachusetts","Francis W. Parker Charter Essential School","42.5489","-71.6063","school","49 Antietam St, Devens, MA 01434, United States","42.5489:-71.6063"
"562",562,"Francis Wyman Elementary School, Burlington, Middlesex County, Massachusetts","Francis Wyman Elementary School","42.5003365","-71.2153958","school","41 Terrace Hall Ave, Burlington, MA 01803, United States","42.5003365:-71.2153958"
"563",563,"Frank H Freedman School, Springfield, Hampden County, Massachusetts","Frank Freedman Elementary School","42.1090402","-72.5249576","school","90 Cherokee Dr, Springfield, MA 01109, United States","42.1090402:-72.5249576"
"564",564,"Frank M Sokolowski Elementary School, Chelsea, Suffolk County, Massachusetts","Frank M Sokolowski Elementary School","42.3993053","-71.0187252","school","300 Crescent Ave, Chelsea, MA 02150, United States","42.3993053:-71.0187252"
"565",565,"Franklin School, Newton, Middlesex County, Massachusetts","Franklin Elementary School","42.3584075","-71.2285842","school","125 Derby St, West Newton, MA 02465, United States","42.3584075:-71.2285842"
"566",566,"Franklin Ave School, Westfield, Hampden County, Massachusetts","Franklin Avenue Elem School","42.1292594","-72.7578717","school","Westfield, MA 01085, United States","42.1292594:-72.7578717"
"567",567,"Franklin County Technical School, Montague, Franklin County, Massachusetts","Franklin County Technical School","42.5976281","-72.5227011","school","82 Industrial Blvd, Turners Falls, MA 01376, United States","42.5976281:-72.5227011"
"568",568,"Franklin D Roosevelt School, Boston, Suffolk County, Massachusetts","Franklin D. Roosevelt K-8 School - Upper Campus","42.24343","-71.124358","school","95 Needham Rd, Hyde Park, MA 02136, United States","42.24343:-71.124358"
"569",569,"Franklin Early Childhood Development School, Franklin, Norfolk County, Massachusetts","Francis X. ORegan Early Childhood Development Center","42.0913716","-71.4057808","school","224 Oak St, Franklin, MA 02038, United States","42.0913716:-71.4057808"
"570",570,"Franklin High School, Franklin, Norfolk County, Massachusetts","Franklin High School","42.0948613","-71.4094396","school","218 Oak St, Franklin, MA 02038, United States","42.0948613:-71.4094396"
"571",571,"Frederick C Murphy School, Weymouth, Norfolk County, Massachusetts","Frederick C Murphy Elementary","42.2056208","-70.9607853","school","417 Front St, Weymouth, MA 02188, United States","42.2056208:-70.9607853"
"572",572,"Frederick Harris School, Springfield, Hampden County, Massachusetts","Frederick Harris","42.0928088","-72.5353904","school","58 Hartford Terrace, Springfield, MA 01118, United States","42.0928088:-72.5353904"
"573",573,"Frederick J Dutile School, Billerica, Middlesex County, Massachusetts","FREDERICK J. DUTILE ELEMENTARY SCHOOL","42.5635618","-71.2940433","school","10 Biagiotti Way, Billerica, MA 01821, United States","42.5635618:-71.2940433"
"574",574,"Frederick W. Hartnett Middle School, Blackstone, Worcester County, Massachusetts","Frederick W Hartnett Middle School","42.0225123","-71.5293806","school","35 Federal St, Blackstone, MA 01504, United States","42.0225123:-71.5293806"
"575",575,"Freeman-Kennedy School, Norfolk, Norfolk County, Massachusetts","Freeman-Kennedy School","42.12417","-71.32359","school","70 Boardman St, Norfolk, MA 02056, United States","42.12417:-71.32359"
"576",576,"Freetown-Lakeville Middle School, Lakeville, Plymouth County, Massachusetts","Freetown Lakeville Middle School","41.7895475","-70.9859969","school","96 Howland Rd, Lakeville, MA 02347, United States","41.7895475:-70.9859969"
"577",577,"Freetown Elementary School, Freetown, Bristol County, Massachusetts","Freetown Elementary School","41.7610549","-71.0147743","school","43 Bullock Rd, East Freetown, MA 02717, United States","41.7610549:-71.0147743"
"578",578,"Frolio Middle School, Abington, Plymouth County, Massachusetts","Charles M. Frolio School","42.1198227","-70.9458777","school","1071 Washington St, Abington, MA 02351, United States","42.1198227:-70.9458777"
"579",579,"Frontier Regional School, Deerfield, Franklin County, Massachusetts","Frontier Regional School","42.4834174","-72.6056371","school","113 N Main St, South Deerfield, MA 01373, United States","42.4834174:-72.6056371"
"580",580,"Frost Middle School, Lawrence, Essex County, Massachusetts","Frost Middle School","42.6850188","-71.1680092","school","33 Hamlet St, Lawrence, MA 01843, United States","42.6850188:-71.1680092"
"581",581,"Full Circle High School, Somerville, Middlesex County, Massachusetts","Full Circle High School","42.3876985","-71.0873656","school","8 Bonair St, Somerville, MA 02145, United States","42.3876985:-71.0873656"
"582",582,"Fuller Meadow School, Middleton, Essex County, Massachusetts","Fuller Meadow School","42.5845385","-71.0092194","school","143 S Main St, Middleton, MA 01949, United States","42.5845385:-71.0092194"
"583",583,"Fuller Middle School, Framingham, Middlesex County, Massachusetts","Fuller Middle School","42.2940744","-71.4172676","school","31 Flagg Dr, Framingham, MA 01702, United States","42.2940744:-71.4172676"
"584",584,"Furnace Brook Middle School, Marshfield, Plymouth County, Massachusetts","Furnace Brook Middle School","42.1064964","-70.7373808","school","500 Furnace St, Marshfield, MA 02050, United States","42.1064964:-70.7373808"
"585",585,"Galvin Middle School, Wakefield, Middlesex County, Massachusetts","Galvin Middle School","42.499618","-71.0708824","school","Wakefield, MA 01880, United States","42.499618:-71.0708824"
"586",586,"Gardner School, Swansea, Bristol County, Massachusetts","Gardner Elementary School","41.7237815","-71.2011779","school","10 Church St, Swansea, MA 02777, United States","41.7237815:-71.2011779"
"587",587,"Gardner Academy for Learning and Technology School, Gardner, Worcester County, Massachusetts","Prospect School","42.5561823","-71.9792568","school","75 E Broadway, Gardner, MA 01440, United States","42.5561823:-71.9792568"
"588",588,"Gardner High School, Gardner, Worcester County, Massachusetts","Gardner High School","42.5840977","-71.9791907","school","200 Catherine St, Gardner, MA 01440, United States","42.5840977:-71.9791907"
"589",589,"Gardner Middle School, Gardner, Worcester County, Massachusetts","Gardner Middle School","42.586195","-71.977047","school","297 Catherine St, Gardner, MA 01440, United States","42.586195:-71.977047"
"590",590,"Gardner Pilot School, Boston, Suffolk County, Massachusetts","Gardner Pilot Academy","42.3607731","-71.1339972","school","30 Athol St, Allston, MA 02134, United States","42.3607731:-71.1339972"
"591",591,"Garfield Elementary School, Revere, Suffolk County, Massachusetts","Garfield Elementary School","42.4036464","-70.9925628","school","176 Garfield Ave, Revere, MA 02151, United States","42.4036464:-70.9925628"
"592",592,"Garfield Middle School, Revere, Suffolk County, Massachusetts","Garfield Elementary School","42.4036464","-70.9925628","school","176 Garfield Ave, Revere, MA 02151, United States","42.4036464:-70.9925628"
