"","X","Query","Google_Place","Lat","Lng","Loc.Type","Address","loc"
"1",1,"1 LT Charles W. Whitcomb School, Marlborough, Middlesex County, Massachusetts","1LT Charles W. Whitcomb Middle School","42.3573012","-71.5488788","school","25 Union St, Marlborough, MA 01752, United States","42.3573012:-71.5488788"
"2",2,"A Drewicz Elementary School, Lynn, Essex County, Massachusetts","Drewicz Elementary School","42.4606105","-70.9693192","school","34 Hood St, Lynn, MA 01905, United States","42.4606105:-70.9693192"
"3",3,"A E Angier School, Newton, Middlesex County, Massachusetts","Albert Edgar Angier School","42.3265807","-71.232528","school","1697 Beacon St, Waban, MA 02468, United States","42.3265807:-71.232528"
"4",4,"A F Maloney School, Blackstone, Worcester County, Massachusetts","John F Kennedy Elementary School","42.0290268","-71.5453968","school","Blackstone, MA 01504, United States","42.0290268:-71.5453968"
"5",5,"A. C. Whelan Elementary School, Revere, Suffolk County, Massachusetts","A. C. Whelan Elementary School","42.4193889","-71.0200305","school","107 Newhall St, Revere, MA 02151, United States","42.4193889:-71.0200305"
"6",6,"A. Irvin Studley Elementary School, Attleboro, Bristol County, Massachusetts","A. Irvin Studley Elementary School","41.9370406","-71.3056095","school","United States","41.9370406:-71.3056095"
"7",7,"Abbot Elementary School, Westford, Middlesex County, Massachusetts","Abbot Elementary School","42.5888414","-71.4323999","school","25 Depot St, Westford, MA 01886, United States","42.5888414:-71.4323999"
"8",8,"Abbott Memorial School, Florida, Berkshire County, Massachusetts","Abbott Memorial School","42.6756385","-73.0370458","school","56 N County Rd, Florida, MA 01247, USA","42.6756385:-73.0370458"
"9",9,"Abby Kelley Foster Charter Public School, Worcester, Worcester County, Massachusetts","Abby Kelley Foster Charter Public School","42.3056051","-71.801641","school","10 New Bond St # 9, Worcester, MA 01606, United States","42.3056051:-71.801641"
"10",10,"Abigail Adams Middle School, Weymouth, Norfolk County, Massachusetts","Abigail Adams Middle School","42.2209564","-70.9399079","school","89 Middle St, East Weymouth, MA 02189, United States","42.2209564:-70.9399079"
"11",11,"Abington High School, Abington, Plymouth County, Massachusetts","Abington High School","42.1185235","-70.9534406","school","201 Gliniewicz Way, Abington, MA 02351, United States","42.1185235:-70.9534406"
"12",12,"Abner Gibbs School, Westfield, Hampden County, Massachusetts","Abner Gibbs Elementary School","42.1146629","-72.753385","school","50 W Silver St, Westfield, MA 01085, United States","42.1146629:-72.753385"
"13",13,"Aborn School, Lynn, Essex County, Massachusetts","Aborn Elementary School","42.4792001","-70.9331225","school","409 Eastern Ave, Lynn, MA 01902, United States","42.4792001:-70.9331225"
"14",14,"Abraham Lincoln School, Lowell, Middlesex County, Massachusetts","Abraham Lincoln Elementary School","42.6303715","-71.3202892","school","300 Chelmsford St, Lowell, MA 01851, United States","42.6303715:-71.3202892"
"15",15,"Academy Avenue School, Weymouth, Norfolk County, Massachusetts","Academy Avenue","42.2206774","-70.9424601","school","94 Academy Ave, Weymouth, MA 02189, United States","42.2206774:-70.9424601"
"16",16,"Academy Of the Pacific Rim Charter Public School, Boston, Suffolk County, Massachusetts","Academy of the Pacific Rim Charter Public School","42.2442784","-71.1321323","school","1 Westinghouse Plaza, Hyde Park, MA 02136, United States","42.2442784:-71.1321323"
"17",17,"ACESE School, Fall River, Bristol County, Massachusetts","Acese","41.6987277","-71.1411647","school","803 Bedford St, Fall River, MA 02723, United States","41.6987277:-71.1411647"
"18",18,"Acton-Boxborough Regional High School, Acton, Middlesex County, Massachusetts","Acton Boxborough Regional High School","42.4796958","-71.4580815","school","36 Charter Rd, Acton, MA 01720, United States","42.4796958:-71.4580815"
"19",19,"Acushnet Elementary School, Acushnet, Bristol County, Massachusetts","Acushnet Elementary School","41.7254237","-70.9059014","school","800 Middle Rd, Acushnet, MA 02743, United States","41.7254237:-70.9059014"
"20",20,"Advanced Math and Science Academy Charter School, Marlborough, Middlesex County, Massachusetts","Advanced Math & Science Academy","42.3324309","-71.5773023","school","201 Forest St, Marlborough, MA 01752, United States","42.3324309:-71.5773023"
"21",21,"Agawam Early Childhood School, Agawam, Hampden County, Massachusetts","Early Childhood Center","42.0670045","-72.6281712","school","108 Perry Ln, Agawam, MA 01001, United States","42.0670045:-72.6281712"
"22",22,"Agawam High School, Agawam, Hampden County, Massachusetts","Agawam High School","42.0742612","-72.6448127","school","760 Cooper St, Agawam, MA 01001, United States","42.0742612:-72.6448127"
"23",23,"Agawam Junior High School, Agawam, Hampden County, Massachusetts","Agawam Junior High School","42.0639905","-72.6738756","school","1305 Springfield St, Feeding Hills, MA 01030, United States","42.0639905:-72.6738756"
"24",24,"Albert F Ford Middle School, Acushnet, Bristol County, Massachusetts","Ford Middle School","41.7233506","-70.9049693","school","708 Middle Rd, Acushnet, MA 02743, United States","41.7233506:-70.9049693"
"25",25,"Albert F. Argenziano School at Lincoln Park School, Somerville, Middlesex County, Massachusetts","Dr. Albert F. Argenziano School at Lincoln Park","42.3789581","-71.0986168","school","290 Washington St, Somerville, MA 02143, United States","42.3789581:-71.0986168"
"26",26,"Albert S. Woodward Memorial School, Southborough, Worcester County, Massachusetts","Woodward School","42.3038635","-71.5275122","school","28 Cordaville Rd, Southborough, MA 01772, United States","42.3038635:-71.5275122"
"27",27,"Alcott School, Concord, Middlesex County, Massachusetts","Alcott Elementary School","42.4533457","-71.3462018","school","93 Laurel St, Concord, MA 01742, United States","42.4533457:-71.3462018"
"28",28,"Alden School, Duxbury, Plymouth County, Massachusetts","Alden Elementary School","42.0464916","-70.6811482","school","Duxbury, MA 02332, United States","42.0464916:-70.6811482"
"29",29,"Alexander B Bruce School, Lawrence, Essex County, Massachusetts","Bruce School","42.7030399","-71.1809864","school","135 Butler St, Lawrence, MA 01841, United States","42.7030399:-71.1809864"
"30",30,"Alfred G Zanetti School, Springfield, Hampden County, Massachusetts","Alfred G. Zanetti Montessori Magnet School","42.1210588","-72.5880539","school","474 Armory St, Springfield, MA 01104, United States","42.1210588:-72.5880539"
"31",31,"Alfred J Gomes School, New Bedford, Bristol County, Massachusetts","Alfred J Gomes","41.6259339","-70.922144","school","286 S 2nd St, New Bedford, MA 02740, United States","41.6259339:-70.922144"
"32",32,"Alfred M Chaffee School, Oxford, Worcester County, Massachusetts","Alfred M Chaffee","42.107418","-71.869529","school","9 Clover St, Oxford, MA 01540, United States","42.107418:-71.869529"
"33",33,"Algonquin Regional High School, Northborough, Worcester County, Massachusetts","Algonquin Regional High School","42.3264826","-71.6125668","school","79 Bartlett St, Northborough, MA 01532, United States","42.3264826:-71.6125668"
"34",34,"Alice A Macomber School, Westport, Bristol County, Massachusetts","Macomber School","41.6526334","-71.082419","school","154 Gifford Rd, Westport, MA 02790, United States","41.6526334:-71.082419"
"35",35,"Alice B Beal Elementary School, Springfield, Hampden County, Massachusetts","Alice B Beal Elementary School","42.07395","-72.544371","school","285 Tiffany St, Springfield, MA 01108, United States","42.07395:-72.544371"
"36",36,"Alice M Barrows School, Reading, Middlesex County, Massachusetts","Barrows School","42.5216213","-71.1240778","school","16 Edgemont Ave, Reading, MA 01867, United States","42.5216213:-71.1240778"
"37",37,"Allen Avenue School, North Attleborough, Bristol County, Massachusetts","Allen Avenue Elementary School","41.9453","-71.3522","school","North Attleborough, MA 02760, United States","41.9453:-71.3522"
"38",38,"Allendale School, Pittsfield, Berkshire County, Massachusetts","Allendale Elementary School","42.4589354","-73.2201378","school","180 Connecticut Ave, Pittsfield, MA 01201, United States","42.4589354:-73.2201378"
"39",39,"Alma del Mar Charter School, New Bedford, Bristol County, Massachusetts","Alma Del Mar Charter School","41.665394","-70.9243195","school","26 Madeira Ave, New Bedford, MA 02746, United States","41.665394:-70.9243195"
"40",40,"Ambrose Elementary School, Winchester, Middlesex County, Massachusetts","Ambrose Elementary School","42.4456653","-71.1562702","school","27 High St, Winchester, MA 01890, United States","42.4456653:-71.1562702"
"41",41,"Amesbury Academy Charter Public School, Amesbury, Essex County, Massachusetts","Amesbury Innovation High School","42.8563052","-70.9348681","school","71 Friend St, Amesbury, MA 01913, United States","42.8563052:-70.9348681"
"42",42,"Amesbury Elementary School, Amesbury, Essex County, Massachusetts","Amesbury Elementary School","42.8660036","-70.9318688","school","Amesbury, MA 01913, United States","42.8660036:-70.9318688"
"43",43,"Amesbury High School, Amesbury, Essex County, Massachusetts","Amesbury High School","42.8510349","-70.9421191","school","5 Highland St, Amesbury, MA 01913, United States","42.8510349:-70.9421191"
"44",44,"Amesbury Middle School, Amesbury, Essex County, Massachusetts","Amesbury Middle School","42.8489847","-70.9294998","school","220 Main St, Amesbury, MA 01913, United States","42.8489847:-70.9294998"
"45",45,"Amherst Regional High School, Amherst, Hampshire County, Massachusetts","Amherst Regional High School","42.380923","-72.512865","school","21 Matoon St, Amherst, MA 01002, United States","42.380923:-72.512865"
"46",46,"Amherst Regional Middle School, Amherst, Hampshire County, Massachusetts","Amherst Regional Middle School","42.3848703","-72.5111073","school","170 Chestnut St, Amherst, MA 01002, United States","42.3848703:-72.5111073"
"47",47,"Amigos School, Cambridge, Middlesex County, Massachusetts","The Amigos School","42.3628407","-71.1083114","school","15 Upton St, Cambridge, MA 02139, United States","42.3628407:-71.1083114"
"48",48,"Amvet Boulevard School, North Attleborough, Bristol County, Massachusetts","Amvet Boulevard School","41.9764595","-71.3427458","school","70 Amvet Blvd, North Attleborough, MA 02760, United States","41.9764595:-71.3427458"
"49",49,"Andover High School, Andover, Essex County, Massachusetts","Andover High School","42.6571642","-71.1554961","school","80 Shawsheen Rd, Andover, MA 01810, United States","42.6571642:-71.1554961"
"50",50,"Andover West Middle School, Andover, Essex County, Massachusetts","West Middle School","42.6590223","-71.1524391","school","70 Shawsheen Rd, Andover, MA 01810, United States","42.6590223:-71.1524391"
"51",51,"Andrew B. Cushman School, Dartmouth, Bristol County, Massachusetts","Andrew B Cushman School","41.5980959","-70.9414674","school","Dartmouth, MA 02748, United States","41.5980959:-70.9414674"
"52",52,"Anna Ware Jackson School, Plainville, Norfolk County, Massachusetts","Anna Ware Jackson","42.0125496","-71.3024081","school","68 Messenger St, Plainville, MA 02762, United States","42.0125496:-71.3024081"
"53",53,"Annie E Fales School, Westborough, Worcester County, Massachusetts","Fales Elementary School","42.2505572","-71.6217827","school","50 Eli Whitney St, Westborough, MA 01581, United States","42.2505572:-71.6217827"
"54",54,"Annie L Sargent School, North Andover, Essex County, Massachusetts","Sargent School","42.671294","-71.09949","school","North Andover, MA 01845, United States","42.671294:-71.09949"
"55",55,"Annie Sullivan Middle School, Franklin, Norfolk County, Massachusetts","Annie Sullivan Middle School","42.1092167","-71.3976458","school","500 Lincoln St, Franklin, MA 02038, United States","42.1092167:-71.3976458"
"56",56,"Another Course To College School, Boston, Suffolk County, Massachusetts","Another Course To College","42.350336","-71.145552","school","20 Warren St, Brighton, MA 02135, United States","42.350336:-71.145552"
"57",57,"Apponequet Regional High School, Lakeville, Plymouth County, Massachusetts","Apponequet Regional High School","41.7920053","-70.9829201","school","100 Howland Rd, Lakeville, MA 02347, United States","41.7920053:-70.9829201"
"58",58,"Archie T Morrison School, Braintree, Norfolk County, Massachusetts","Archie T Morrison School","42.2103133","-70.9791444","school","348 Pond St, Braintree, MA 02184, United States","42.2103133:-70.9791444"
"59",59,"Arlington Elementary School, Lawrence, Essex County, Massachusetts","Community Day Arlington Elementary School","42.7172958","-71.1740356","school","150 Arlington St, Lawrence, MA 01841, United States","42.7172958:-71.1740356"
"60",60,"Arlington High School, Arlington, Middlesex County, Massachusetts","Arlington High School","42.4181552","-71.1617215","school","869 Massachusetts Ave, Arlington, MA 02476, United States","42.4181552:-71.1617215"
"61",61,"Arlington Middle School, Lawrence, Essex County, Massachusetts","Arlington Middle School","42.7171857","-71.1739799","school","150 Arlington St, Lawrence, MA 01841, United States","42.7171857:-71.1739799"
"62",62,"Arthur D Healey School, Somerville, Middlesex County, Massachusetts","Arthur D Healey School","42.3975844","-71.0953226","school","5 Meacham St, Somerville, MA 02145, United States","42.3975844:-71.0953226"
"63",63,"Arthur M Longsjo Middle School, Fitchburg, Worcester County, Massachusetts","Longsjo Middle School","42.586484","-71.8004799","school","98 Academy St, Fitchburg, MA 01420, United States","42.586484:-71.8004799"
"64",64,"Arthur T Talmadge School, Springfield, Hampden County, Massachusetts","Arthur T Talmadge School","42.0957839","-72.5142865","school","1395 Allen St, Springfield, MA 01118, United States","42.0957839:-72.5142865"
"65",65,"Arthur T. Cummings Elementary School, Winthrop, Suffolk County, Massachusetts","Arthur T. Cummings Elementary School","42.377364","-70.9855275","school","40 Hermon St, Winthrop, MA 02152, United States","42.377364:-70.9855275"
"66",66,"Arthur W Coolidge Middle School, Reading, Middlesex County, Massachusetts","Arthur W Coolidge Middle School","42.5378721","-71.1106098","school","89 Birch Meadow Dr, Reading, MA 01867, United States","42.5378721:-71.1106098"
"67",67,"Ashby Elementary School, Ashby, Middlesex County, Massachusetts","Ashby Elementary School","42.678931","-71.824322","school","911 Main St, Ashby, MA 01431, United States","42.678931:-71.824322"
"68",68,"Ashfield Middle School, Brockton, Plymouth County, Massachusetts","East Junior High School","42.0846723","-71.0005526","school","464 Centre St, Brockton, MA 02302, United States","42.0846723:-71.0005526"
"69",69,"Ashland High School, Ashland, Middlesex County, Massachusetts","Ashland High School","42.2623135","-71.4457498","school","65 E Union St, Ashland, MA 01721, United States","42.2623135:-71.4457498"
"70",70,"Ashland Middle School, Ashland, Middlesex County, Massachusetts","Ashland Middle School","42.2516651","-71.4749157","school","87 W Union St, Ashland, MA 01721, United States","42.2516651:-71.4749157"
"71",71,"Assabet Valley Vocational High School, Marlborough, Middlesex County, Massachusetts","Assabet Valley Regional Technical High School","42.3683008","-71.5666979","school","215 Fitchburg St, Marlborough, MA 01752, United States","42.3683008:-71.5666979"
"72",72,"Assawompset Elementary School, Lakeville, Plymouth County, Massachusetts","Assawompset Elementary School","41.8475675","-70.9470105","school","232 Main St, Lakeville, MA 02347, United States","41.8475675:-70.9470105"
"73",73,"Atherton Hough School, Quincy, Norfolk County, Massachusetts","Atherton Hough Elementary School","42.2678934","-70.9572271","school","1084 Sea St, Quincy, MA 02169, United States","42.2678934:-70.9572271"
"74",74,"Athol-Royalston Middle School, Athol, Worcester County, Massachusetts","Athol-Royalston Middle School","42.573459","-72.212786","school","1062 Pleasant St, Athol, MA 01331, United States","42.573459:-72.212786"
"75",75,"Athol High School, Athol, Worcester County, Massachusetts","Athol High School","42.5828","-72.204567","school","2363 Main St, Athol, MA 01331, United States","42.5828:-72.204567"
"76",76,"Atkinson School, North Andover, Essex County, Massachusetts","Atkinson Elementary School","42.6897308","-71.1230929","school","111 Phillips Brooks Rd, North Andover, MA 01845, United States","42.6897308:-71.1230929"
"77",77,"Atlantic Middle School, Quincy, Norfolk County, Massachusetts","Atlantic Middle School","42.2776863","-71.0245389","school","86 Hollis Ave, Quincy, MA 02171, United States","42.2776863:-71.0245389"
"78",78,"Atlantis Charter School, Fall River, Bristol County, Massachusetts","Atlantis Charter School","41.6940842","-71.1630732","school","37 Park St, Fall River, MA 02721, United States","41.6940842:-71.1630732"
"79",79,"Attleboro High School, Attleboro, Bristol County, Massachusetts","Attleboro High School","41.9387002","-71.3030112","school","100 Rathbun Willard Dr, Attleboro, MA 02703, United States","41.9387002:-71.3030112"
"80",80,"Auburn Middle School, Auburn, Worcester County, Massachusetts","Auburn Middle School","42.1836095","-71.8681497","school","9 West St, Auburn, MA 01501, United States","42.1836095:-71.8681497"
"81",81,"Auburn Senior High School, Auburn, Worcester County, Massachusetts","Auburn Senior High School","42.2077771","-71.8369818","school","99 Auburn St, Auburn, MA 01501, United States","42.2077771:-71.8369818"
"82",82,"Avery School, Dedham, Norfolk County, Massachusetts","Avery Elementary School","42.2468838","-71.1603438","school","336 High St, Dedham, MA 02026, United States","42.2468838:-71.1603438"
"83",83,"Avon Middle High School, Avon, Norfolk County, Massachusetts","Avon Middle High School","42.1294654","-71.0430606","school","285 W Main St, Avon, MA 02322, United States","42.1294654:-71.0430606"
"84",84,"Ayer Shirley Regional High School, Ayer, Middlesex County, Massachusetts","Ayer Shirley Regional High School","42.5667399","-71.5757882","school","141 Washington St, Ayer, MA 01432, United States","42.5667399:-71.5757882"
"85",85,"Ayer Shirley Regional Middle School, Shirley, Middlesex County, Massachusetts","Ayer Shirley Regional High School","42.5667399","-71.5757882","school","141 Washington St, Ayer, MA 01432, United States","42.5667399:-71.5757882"
"86",86,"Ayers/Ryal Side School, Beverly, Essex County, Massachusetts","Ayers/Ryal Side School","42.5512062","-70.890327","school","40 Woodland Ave, Beverly, MA 01915, United States","42.5512062:-70.890327"
"87",87,"B B Russell Alternative School, Brockton, Plymouth County, Massachusetts","B.B. Russell Alternative School","42.0824626","-71.0231467","school","175 Warren Ave, Brockton, MA 02301, United States","42.0824626:-71.0231467"
"88",88,"B M C Durfee High School, Fall River, Bristol County, Massachusetts","B.M.C. Durfee High School","41.715696","-71.131804","school","360 Elsbree St, Fall River, MA 02720, United States","41.715696:-71.131804"
"89",89,"B.F.Butler Middle School, Lowell, Middlesex County, Massachusetts","Butler Middle School","42.6249067","-71.3067623","school","1140 Gorham St, Lowell, MA 01852, United States","42.6249067:-71.3067623"
"90",90,"Balch School, Norwood, Norfolk County, Massachusetts","Balch Elementary School","42.1769257","-71.205466","school","1170 Washington St, Norwood, MA 02062, United States","42.1769257:-71.205466"
"91",91,"Baldwin Early Learning School, Boston, Suffolk County, Massachusetts","Baldwin Early Learning Center","42.3420345","-71.1405303","school","121 Corey Rd, Brighton, MA 02135, United States","42.3420345:-71.1405303"
"92",92,"Baldwinville Elementary School, Templeton, Worcester County, Massachusetts","Baldwinville Elementary School","42.6051124","-72.0751023","school","16 School St, Baldwinville, MA 01436, United States","42.6051124:-72.0751023"
"17601",93,"Peas In A Pod Nursery School, Saugus, Essex Count, MA","Peas In A Pod Nursery School","42.4802624","-71.0417344","school","22- 28 Richard St, Saugus, MA 01906, United States","42.4802624:-71.0417344"
"94",94,"Balliet Middle School, Springfield, Hampden County, Massachusetts","Balliet Middle School","42.1253185","-72.5288356","school","111 Seymour Ave, Springfield, MA 01109, United States","42.1253185:-72.5288356"
"95",95,"Bancroft Elementary School, Andover, Essex County, Massachusetts","Bancroft Elementary School","42.6370369","-71.1258895","school","15 Bancroft Rd, Andover, MA 01810, United States","42.6370369:-71.1258895"
"96",96,"Barbieri Elementary School, Framingham, Middlesex County, Massachusetts","Barbieri Elementary School","42.2795401","-71.4322836","school","100 Dudley Rd, Framingham, MA 01702, United States","42.2795401:-71.4322836"
"97",97,"Barnstable Community Horace Mann Charter Public School, Barnstable, Barnstable County, Massachusetts","Barnstable Community Horace Mann Charter Public School","41.6555139","-70.2931715","school","165 Bearses Way, Hyannis, MA 02601, United States","41.6555139:-70.2931715"
"98",98,"Barnstable High School, Barnstable, Barnstable County, Massachusetts","Barnstable High School","41.6549357","-70.3213375","school","744 W Main St, Hyannis, MA 02601, United States","41.6549357:-70.3213375"
"99",99,"Barnstable Intermediate School, Barnstable, Barnstable County, Massachusetts","Barnstable Community Horace Mann Charter Public School","41.6555139","-70.2931715","school","165 Bearses Way, Hyannis, MA 02601, United States","41.6555139:-70.2931715"
"100",100,"Barnstable United Elementary School, Barnstable, Barnstable County, Massachusetts","Barnstable Community Horace Mann Charter Public School","41.6555139","-70.2931715","school","165 Bearses Way, Hyannis, MA 02601, United States","41.6555139:-70.2931715"
"101",101,"Barry School, Chicopee, Hampden County, Massachusetts","Barry","42.1662428","-72.5878661","school","44 Connell St, Chicopee, MA 01020, United States","42.1662428:-72.5878661"
"102",102,"Bartlett Community Partnership School, Lowell, Middlesex County, Massachusetts","Bartlett Community Partnership school","42.6454124","-71.328907","school","79 Wannalancit St, Lowell, MA 01854, United States","42.6454124:-71.328907"
"103",103,"Bartlett Jr Sr High School, Webster, Worcester County, Massachusetts","Bartlett High School","42.041644","-71.8704317","school","52 Lake Pkwy, Webster, MA 01570, United States","42.041644:-71.8704317"
"104",104,"Bartlett Kindergarten School, Haverhill, Essex County, Massachusetts","Kiddie Academy of Streamwood","42.015603","-88.204371","school","1040 S Sutton Rd, Streamwood, IL 60107, United States","42.015603:-88.204371"
"105",105,"Bates School, Salem, Essex County, Massachusetts","Bates Elementary School","42.5348416","-70.9057349","school","53 Liberty Hill Ave, Salem, MA 01970, United States","42.5348416:-70.9057349"
"106",106,"Bay Path Regional Vocational Technical High School, Charlton, Worcester County, Massachusetts","Bay Path Regional Vocational Technical High School","42.1334266","-71.9564352","school","57 Old Muggett Hill Rd, Charlton, MA 01507, United States","42.1334266:-71.9564352"
"107",107,"Beachmont Veterans Memorial School, Revere, Suffolk County, Massachusetts","Beachmont Veterans Memorial School: School Department","42.412088","-71.0081159","school","101 School St, Revere, MA 02151, United States","42.412088:-71.0081159"
"108",108,"Beal School, Shrewsbury, Worcester County, Massachusetts","Beal Early Childhood Center","42.2955565","-71.715725","school","1 Maple Ave, Shrewsbury, MA 01545, United States","42.2955565:-71.715725"
"109",109,"Beatrice H Wood Elementary School, Plainville, Norfolk County, Massachusetts","Beatrice H. Wood Elementary School","42.01339","-71.3011548","school","72 Messenger St, Plainville, MA 02762, United States","42.01339:-71.3011548"
"110",110,"Beaver Brook Elementary School, Abington, Plymouth County, Massachusetts","Beaver Brook Elementary","42.119108","-70.9439993","school","1 Ralph G Hamlin Jr Ln, Abington, MA 02351, United States","42.119108:-70.9439993"
"111",111,"Becket Washington School, Becket, Berkshire County, Massachusetts","Becket Washington School","42.3314762","-73.0828803","school","12 Maple St, Becket, MA 01223, United States","42.3314762:-73.0828803"
"112",112,"Bedford High School, Bedford, Middlesex County, Massachusetts","Bedford High School","42.4913203","-71.2853963","school","9 Mudge Way, Bedford, MA 01730, United States","42.4913203:-71.2853963"
"113",113,"Beebe School, Malden, Middlesex County, Massachusetts","Beebe School","42.4271649","-71.0794857","school","401 Pleasant St, Malden, MA 02148, United States","42.4271649:-71.0794857"
"114",114,"Beechwood Knoll Elementary School, Quincy, Norfolk County, Massachusetts","Beechwood Knoll Elementary School","42.26937","-71.0053414","school","225 Fenno St, Quincy, MA 02170, United States","42.26937:-71.0053414"
"115",115,"Beeman Memorial School, Gloucester, Essex County, Massachusetts","Beeman Elementary School","42.6369666","-70.672473","school","138 Cherry St, Gloucester, MA 01930, United States","42.6369666:-70.672473"
"116",116,"Beethoven School, Boston, Suffolk County, Massachusetts","Beethoven Elementary School","42.26352","-71.155824","school","5125 Washington St, West Roxbury, MA 02132, United States","42.26352:-71.155824"
"117",117,"Belcher School, Chicopee, Hampden County, Massachusetts","Belcher Elementary School","42.1632189","-72.5836064","school","125 Montgomery St, Chicopee, MA 01020, United States","42.1632189:-72.5836064"
"118",118,"Belchertown High School, Belchertown, Hampshire County, Massachusetts","Belchertown High School","42.2664573","-72.4101427","school","142 Springfield Rd, Belchertown, MA 01007, United States","42.2664573:-72.4101427"
